00:10:54.240;If you think about it, most humans are kind of stupid. I mean, we do all sorts of crazy,
00:10:59.360;stupid things, right? And we call it art. We call it humor. We call it human civilization.
00:11:06.240;So why should an advanced civilization go through all that effort just to simulate Saturday Night
00:11:12.640;Live? Well, that's a funny idea. But it's also, do you think it's possible that the act of creation
00:11:20.080;cannot anticipate humans? You simply set the initial conditions and set a bunch of physical
00:11:25.200;laws and just for the fun of it, see what happens. You launch the thing. So you're not necessarily
00:11:30.640;simulating everything. You're not simulating every little bit in the sense that you could
00:11:35.680;predict what's going to happen. But you set the initial conditions, set the laws and see what
00:11:41.440;kind of fun stuff happens. Well, in some sense, that's how life got started. In the 1950s, Stanley
00:11:49.280;did what is called the Miller experiment. He put a bunch of hydrogen gas, methane, toxic gases
00:11:57.680;with liquid and a spark in a small glass beaker. And then he just walked away for a few weeks,
00:12:05.040;came back a few weeks later and bingo, out of nothing in chaos came amino acids.
00:12:12.720;If he had left it there for a few years, he might have gotten protein, protein molecules for free.
00:12:19.120;That's probably how life got started as a accident. And if he had left it there for perhaps
00:12:25.600;a few million years, DNA might have formed in that beaker. And so we think that, yeah, DNA,
00:12:32.960;life, all that could have been an accident if you wait long enough. And remember, our universe is
00:12:39.680;roughly 13.8 billion years old. That's plenty of time for lots of random things to happen,
00:12:46.800;including life itself. Yeah, we could be just a beautiful little random moment. And there's could
00:12:57.520;be, you know, the infinite number of those throughout the history of the universe. Many
00:13:03.280;creatures like us, we perhaps are not the epitome of what the universe was created for. Thank God.
00:13:09.760;Let's hope not. Just look around. Yeah. Look to your left, look to your right.
00:13:16.080;When do you think the first human will step foot on Mars? I think it's a good chance in the 2030s
00:13:23.280;that we will be on Mars. In fact, there's no physics reason why we can't do it. It's an
00:13:29.920;engineering problem. It's a very difficult and dangerous engineering problem, but it is an
00:13:35.200;engineering problem. And in my book, Future of Humanity, I even speculate beyond that,
00:13:41.040;that by the end of the century, we'll probably have the first starships. The first starships
00:13:46.640;will not look like the Enterprise at all. There'll probably be small computer chips that are fired by
00:13:52.480;laser beams with parachutes. And like what Stephen Hawking advocated, the Breakthrough
00:13:59.040;Starshot program could send chips, chips to the nearby stars traveling at 20% the speed of light,
00:14:05.440;reaching Alpha Centauri in about 20 years time. Beyond that, we should have fusion power.
00:14:12.800;Fusion power is, in some sense, one of the ultimate sources of energy,
00:14:17.920;but it's unstable. And we don't have fusion power today. Now, why is that? First of all,
00:14:24.160;stars form almost for free. You get a bunch of gas, large enough, it becomes a star. I mean,
00:14:30.000;you don't even have to do anything to it, and it becomes a star. Why is fusion so difficult to put
00:14:36.320;on the Earth? Because in outer space, stars are monopoles. They are poles, single poles that are
00:14:43.120;spherically symmetric, and it's very easy to get spherically symmetric configurations of gas
00:14:48.800;to compress into a star. It just happens naturally all by itself. The problem is magnetism is
00:14:55.280;bipolar. You have a North Pole and a South Pole, and it's like trying to squeeze a long balloon.
00:15:02.240;Take a long balloon and try to squeeze it. You squeeze one side, it bulges out the other side.
00:15:08.080;Well, that's the problem with fusion machines. We use magnetism with the North Pole and the South
00:15:12.800;Pole to squeeze gas, and all sorts of anomalies and horrible configurations can take place,
00:15:20.160;because we're not squeezing something uniformly like in a star. Stars, in some sense, are for free.
00:15:27.120;Fusion on the Earth is very difficult. But I think it's inevitable, and it'll eventually give us
00:15:34.480;unlimited power from seawater. So seawater will be the ultimate source of energy for the planet
00:15:40.400;Earth. Why? What's the intuition there? Because we'll extract hydrogen from seawater, burn hydrogen
00:15:46.320;in a fission reactor to give us unlimited energy without the meltdown, without the nuclear waste.
00:15:53.840;Why do we have meltdowns? We have meltdowns because in the fission reactors, every time you split the
00:15:58.560;uranium atom, you get nuclear waste. Tons of it. 30 tons of nuclear waste per reactor per year.
00:16:07.040;And it's hot. It's hot for thousands, millions of years. That's why we have meltdowns. But you see,
00:16:13.600;the waste product of a fusion reactor is helium gas. Helium gas is actually commercially valuable.
00:16:19.760;You can make money selling helium gas. And so the waste product of a fusion reactor is helium,
00:16:26.160;not nuclear waste that we find in a commercial fission plant.
00:16:30.640;And that controlling, mastering and controlling fusion allows us to convert this into a type one,
00:16:38.240;I guess, civilization, right?
00:16:40.080;Yeah, probably the backbone of a type one civilization will be fusion power. We, by the
00:16:46.080;way, are type zero. We don't even rate on this scale. We get our energy from dead plants, for
00:16:51.280;God's sake, oil and coal. But we are about 100 years from being type one. You know, get a
00:16:56.480;calculator. In fact, Carl Sagan calculated that we are about 0.7. Fairly close to a 1.0. For example,
00:17:07.120;what is the Internet? The Internet is the beginning of the first type one technology
00:17:12.160;to enter into our century. The first planetary technology is the Internet.
00:17:17.360;What is the language of type one? On the Internet already, English and Mandarin Chinese
00:17:23.360;are the most dominant languages on the Internet. And what about the culture? We're seeing a type
00:17:30.480;one sports, soccer, the Olympics, a type one music, youth culture, rock and roll, rap music,
00:17:38.800;type one fashion, Gucci, Chanel, a type one economy, the European Union, NAFTA, what have you.
00:17:45.440;So we're beginning to see the beginnings of a type one culture and a type one civilization.
00:17:52.480;Inevitably, it will spread beyond this planet. You talked about sending at 20% the speed of light
00:18:00.640;on a chip into Alpha Centauri. But in a slightly nearer term, what do you think about the idea
00:18:08.800;when we still have to send our biological bodies, the colonization of planets, colonization of Mars?
00:18:16.400;Do you see us becoming a two planet species ever or anytime soon? Well, just remember the dinosaurs
00:18:26.240;did not have a space program. And that's why they're not here today. How come there are no
00:18:30.880;dinosaurs in this room today? Because they didn't have a space program. We do have a space program,
00:18:37.920;which means that we have an insurance policy. Now, I don't think we should bankrupt the Earth
00:18:42.960;or deplete the Earth to go to Mars. That's too expensive and not practical. But we need a
00:18:48.240;settlement, a settlement on Mars in case something bad happens to the planet Earth. And that means we
00:18:54.400;have to terraform Mars. Now, to terraform Mars, if we could raise the temperature of Mars by six degrees,
00:19:01.360;six degrees, then the polar ice caps begin to melt, releasing water vapor. Water vapor is the greenhouse gas.
00:19:10.400;It causes even more melting of the ice caps. So it becomes a self-fulfilling prophecy. It feeds on itself.
00:19:18.720;It becomes autocatalytic. And so once you hit six degrees, rising of the temperature on Mars by six
00:19:25.280;degrees, it takes off. And we melt the polar ice caps and liquid water once again flows in the
00:19:32.880;rivers, the canals, the channels and the oceans of Mars. Mars once had an ocean, we think, about the size
00:19:40.400;of the United States. And so that is a possibility. Now, how do we get there? How do we raise the
00:19:46.640;temperature of Mars by six degrees? Elon Musk would like to detonate hydrogen warheads on the polar
00:19:52.160;ice caps. Well, I'm not sure about that because we don't know that much about the effects of...
00:00:00.000;detonating hydrogen warheads to melt the polar ice caps. And who wants to glow in the dark at
00:00:05.120;night reading the newspaper? So I think there are other ways to do it with solar satellites.
00:00:11.760;You can have satellites orbiting Mars that beam sunlight onto the polar ice caps,
00:00:17.520;melting the polar ice caps. Mars has plenty of water, it's just frozen.
00:00:22.640;I think you paint an inspiring and a wonderful picture of the future. I think you've inspired
00:00:31.920;and educated thousands, if not millions. Michio, it's been an honor. Thank you so much for talking
00:00:38.240;today. My pleasure.
00:00:52.640;Thank you.
